{"blockers":[],"context_refs":[{"freshness":"current","kind":"intent-index/v0","ref":"evidence:E-0414","sha256":"sha256:ecb35ba3ee30e6813ac912c4c8e83744468ca49ab3392ff8a7f92b1c501416cc"},{"freshness":"current","kind":"master-trace/v0","ref":"evidence:E-0410","sha256":"sha256:d36501f47e3ca9f3bfb255a5fc804bb15169514dea24d83a19be1c15b23113ae"}],"contract_version":"handoff-packet/v1","current_state":"TODO","decisions":[],"estimated_token_count":1312,"generated_at":"2026-07-15T06:32:02Z","intent_index_ref":"evidence:E-0414","next_safe_action":{"command":"pcl context pack --task T-0086 --include-code-context --json","text":"Review fresh target-bound context before continuing implementation."},"omitted_sections":["evidence_bodies","full_transcript"],"packet_id":"hp-sha256:71215ea96333d04723e08ea9cb7c15acc56a4072ca5a2db6671f8f23de39cc99","producer":{"name":"project-loop-harness","version":"0.5.0"},"restart_context":{"acceptance_ref":null,"acceptance_status":"intent_only","changed_paths":[],"documentation_candidates":[],"evidence_resolution_commands":["pcl evidence show E-0410 --json","pcl evidence show E-0414 --json"],"target_intent":"Frozen 0181 evaluation case TRE-010. Consumer receives only its handoff packet, referenced copied artifacts, and repository state.","target_review_command":"pcl task read T-0086 --json","verification_commands":[]},"risks":["Task risk is low."],"size_bytes":2837,"summary":"Task T-0086 (Frozen 0181 evaluation case TRE-010. Consumer receives only its handoff packet, referenced copied artifacts, and repository state.) is todo; no valid target-bound completion packet was found.","target":{"id":"T-0086","repository_revision":"e40168577a63514fb39170c343b91e9e68bd31d0","type":"task","work_brief_ref":null},"token_estimator":"charclass/v1","trace_claim_ref_budget":{"included_bytes":724,"included_items":2,"max_bytes":4096,"max_items":8},"trace_claim_ref_omissions":[],"trace_claim_refs":[{"claim":"The consumer must treat index wording as unverified until copied source lines are opened.","intent_index_ref":"evidence:E-0414","item_id":"I-001","kind":"constraint_hint","source_refs":[{"evidence_id":"E-0410","line_end":10,"line_start":9,"stored_path":".project-loop/evidence/adhoc-files/e-0410/01-v0.5.1-trace-source-b.md"}],"trust":"unverified"},{"claim":"Run the frozen repository B schema test and report whether it passes without transcript access.","intent_index_ref":"evidence:E-0414","item_id":"I-002","kind":"next_action_hint","source_refs":[{"evidence_id":"E-0410","line_end":12,"line_start":11,"stored_path":".project-loop/evidence/adhoc-files/e-0410/01-v0.5.1-trace-source-b.md"}],"trust":"unverified"}],"unverified":[{"reason":"Resume does not promote state or Evidence summaries into verified facts.","text":"No valid target-bound completion packet is available."}],"verified":[]}
