{"blockers":[],"context_refs":[{"freshness":"current","kind":"intent-index/v0","ref":"evidence:E-0415","sha256":"sha256:9e46c291e9eb1262375141ac675c4b1104f412cd0af7a9010418b89dbfc77cbe"},{"freshness":"current","kind":"master-trace/v0","ref":"evidence:E-0410","sha256":"sha256:d36501f47e3ca9f3bfb255a5fc804bb15169514dea24d83a19be1c15b23113ae"}],"contract_version":"handoff-packet/v1","current_state":"TODO","decisions":[],"estimated_token_count":895,"generated_at":"2026-07-15T06:32:02Z","intent_index_ref":"evidence:E-0415","next_safe_action":{"command":"pcl context pack --task T-0083 --include-code-context --json","text":"Review fresh target-bound context before continuing implementation."},"omitted_sections":["evidence_bodies","full_transcript","trace_claim_refs:invalid_binding"],"packet_id":"hp-sha256:1f0015daf6221bf573fe0ecff3e1536176b964686c41f7828643acb565c125bb","producer":{"name":"project-loop-harness","version":"0.5.0"},"restart_context":{"acceptance_ref":null,"acceptance_status":"intent_only","changed_paths":[],"documentation_candidates":[],"evidence_resolution_commands":["pcl evidence show E-0410 --json","pcl evidence show E-0415 --json"],"target_intent":"Frozen 0181 evaluation case TRE-007. Consumer receives only its handoff packet, referenced copied artifacts, and repository state.","target_review_command":"pcl task read T-0083 --json","verification_commands":[]},"risks":["Task risk is low."],"size_bytes":1995,"summary":"Task T-0083 (Frozen 0181 evaluation case TRE-007. Consumer receives only its handoff packet, referenced copied artifacts, and repository state.) is todo; no valid target-bound completion packet was found.","target":{"id":"T-0083","repository_revision":"e40168577a63514fb39170c343b91e9e68bd31d0","type":"task","work_brief_ref":null},"token_estimator":"charclass/v1","unverified":[{"reason":"Resume does not promote state or Evidence summaries into verified facts.","text":"No valid target-bound completion packet is available."}],"verified":[]}
