{"blockers":[],"context_refs":[{"freshness":"current","kind":"intent-index/v0","ref":"evidence:E-0430","sha256":"sha256:624dc1bde46d92339bb4f84a6d2d0d105c70924c50653d7aaed59352a5142ca7"},{"freshness":"current","kind":"master-trace/v0","ref":"evidence:E-0424","sha256":"sha256:9740089086968eecb605e69253f76b01821f60dec4786fe8891fbcf18c0fe721"}],"contract_version":"handoff-packet/v1","current_state":"TODO","decisions":[],"estimated_token_count":1252,"generated_at":"2026-07-15T07:16:32Z","intent_index_ref":"evidence:E-0430","next_safe_action":{"command":"pcl context pack --task T-0094 --include-code-context --json","text":"Review fresh target-bound context before continuing implementation."},"omitted_sections":["evidence_bodies","full_transcript"],"packet_id":"hp-sha256:e81cc6d7e22b1197b08ba0571e1f5ff30aef12e166fa15fbe9161253ab3fba0d","producer":{"name":"project-loop-harness","version":"0.5.0"},"restart_context":{"acceptance_ref":null,"acceptance_status":"intent_only","changed_paths":[],"documentation_candidates":[],"evidence_resolution_commands":["pcl evidence show E-0424 --json","pcl evidence show E-0430 --json"],"target_intent":"TRE2-008 video-os-v2-spec valid cross-runtime resume","target_review_command":"pcl task read T-0094 --json","verification_commands":[]},"risks":["Task risk is low."],"size_bytes":2687,"summary":"Task T-0094 (TRE2-008 video-os-v2-spec valid cross-runtime resume) is todo; no valid target-bound completion packet was found.","target":{"id":"T-0094","repository_revision":"e40168577a63514fb39170c343b91e9e68bd31d0","type":"task","work_brief_ref":null},"token_estimator":"charclass/v1","trace_claim_ref_budget":{"included_bytes":730,"included_items":2,"max_bytes":4096,"max_items":8},"trace_claim_ref_omissions":[],"trace_claim_refs":[{"claim":"The consumer must keep claims unverified and must not treat this evaluation as release authorization.","intent_index_ref":"evidence:E-0430","item_id":"I-001","kind":"constraint_hint","source_refs":[{"evidence_id":"E-0424","line_end":37,"line_start":35,"stored_path":".project-loop/evidence/adhoc-files/e-0424/01-v0.5.1-trace-source-02-b.md"}],"trust":"unverified"},{"claim":"Run the frozen repository B schema test and report the bounded handoff conditions.","intent_index_ref":"evidence:E-0430","item_id":"I-002","kind":"next_action_hint","source_refs":[{"evidence_id":"E-0424","line_end":40,"line_start":38,"stored_path":".project-loop/evidence/adhoc-files/e-0424/01-v0.5.1-trace-source-02-b.md"}],"trust":"unverified"}],"unverified":[{"reason":"Resume does not promote state or Evidence summaries into verified facts.","text":"No valid target-bound completion packet is available."}],"verified":[]}
