{"blockers":[],"context_refs":[{"freshness":"unknown","kind":"adhoc_artifact","ref":"evidence:E-0422","sha256":"sha256:197f408259e5b329abea7f169e19a67bbf5885d41fa5550be81bb7c6fa788f87"},{"freshness":"unknown","kind":"adhoc_artifact","ref":"evidence:E-0421","sha256":"sha256:4946f1ba16bfec1387325594778c8f18623259a48d475f54136d55812cd7e18f"},{"freshness":"unknown","kind":"adhoc_bundle","ref":"evidence:E-0420","sha256":"sha256:c2be9da95d34eb778e5739f8bbaf2cb828ac1e2b1f7e2674a6356e2f9bfbf962"},{"freshness":"unknown","kind":"adhoc_artifact","ref":"evidence:E-0419","sha256":"sha256:d15d1885f701e821b0d6a0ca0a44b4ec420d5c3dfe4054dd8b007fd36272d6c2"},{"freshness":"current","kind":"master-trace-context/v0","ref":"evidence:E-0418","sha256":"sha256:f479d9f2130dd9f1b8501128da49d5e58c42dea337dfad9c0191223986f6bfe1"},{"freshness":"current","kind":"master-trace-context/v0","ref":"evidence:E-0417","sha256":"sha256:644dea73ef7e564a5298089528aed0ce3d52469f7175d1f9f6ca0f7af7c7fd3d"}],"contract_version":"handoff-packet/v1","current_state":"IN_PROGRESS","decisions":[],"estimated_token_count":1232,"generated_at":"2026-07-15T07:16:32Z","intent_index_ref":null,"next_safe_action":{"command":"pcl context pack --task T-0066 --include-code-context --json","text":"Review fresh target-bound context before continuing implementation."},"omitted_sections":["evidence_bodies","full_transcript","trace_claim_refs:selection_required"],"packet_id":"hp-sha256:6c0cf8ae86bb21bf3c18aacc587c7bbd6a2583c76e5447da38b91dbc2e966494","producer":{"name":"project-loop-harness","version":"0.5.0"},"restart_context":{"acceptance_ref":null,"acceptance_status":"intent_only","changed_paths":[],"documentation_candidates":[],"evidence_resolution_commands":["pcl evidence show E-0417 --json","pcl evidence show E-0418 --json","pcl evidence show E-0419 --json","pcl evidence show E-0420 --json","pcl evidence show E-0421 --json","pcl evidence show E-0422 --json"],"target_intent":"0181として、外部利用者を待たず2つの所有repo・10ケースでclaim-bound Trace resumeを実測し、broken binding safe-stop・trust境界・size比を評価する","target_review_command":"pcl task read T-0066 --json","verification_commands":[]},"risks":[],"size_bytes":2849,"summary":"Task T-0066 (0181として、外部利用者を待たず2つの所有repo・10ケースでclaim-bound Trace resumeを実測し、broken binding safe-stop・trust境界・size比を評価する) is in_progress; no valid target-bound completion packet was found.","target":{"id":"T-0066","repository_revision":"e40168577a63514fb39170c343b91e9e68bd31d0","type":"task","work_brief_ref":null},"token_estimator":"charclass/v1","unverified":[{"reason":"Resume does not promote state or Evidence summaries into verified facts.","text":"No valid target-bound completion packet is available."}],"verified":[]}
