{"blockers":[],"context_refs":[{"freshness":"current","kind":"intent-index/v0","ref":"evidence:E-0426","sha256":"sha256:77a475eccdced0d226ad13a2ef9024308f3da2366f0d237fc959f1b60d309c0a"},{"freshness":"current","kind":"master-trace/v0","ref":"evidence:E-0423","sha256":"sha256:a4af8f360aaf55273eafcbf62db414b2d8469e36e9ffce2e74cbab96e4cfd384"}],"contract_version":"handoff-packet/v1","current_state":"TODO","decisions":[],"estimated_token_count":834,"generated_at":"2026-07-15T07:16:32Z","intent_index_ref":"evidence:E-0426","next_safe_action":{"command":"pcl context pack --task T-0091 --include-code-context --json","text":"Review fresh target-bound context before continuing implementation."},"omitted_sections":["evidence_bodies","full_transcript","trace_claim_refs:invalid_binding"],"packet_id":"hp-sha256:f29b912ffb7a5dde89789f8a1d1ef7c3e2a74716e0868c8440677173942e0693","producer":{"name":"project-loop-harness","version":"0.5.0"},"restart_context":{"acceptance_ref":null,"acceptance_status":"intent_only","changed_paths":[],"documentation_candidates":[],"evidence_resolution_commands":["pcl evidence show E-0423 --json","pcl evidence show E-0426 --json"],"target_intent":"TRE2-005 project-loop-harness invalid line range safe-stop","target_review_command":"pcl task read T-0091 --json","verification_commands":[]},"risks":["Task risk is medium."],"size_bytes":1854,"summary":"Task T-0091 (TRE2-005 project-loop-harness invalid line range safe-stop) is todo; no valid target-bound completion packet was found.","target":{"id":"T-0091","repository_revision":"e40168577a63514fb39170c343b91e9e68bd31d0","type":"task","work_brief_ref":null},"token_estimator":"charclass/v1","unverified":[{"reason":"Resume does not promote state or Evidence summaries into verified facts.","text":"No valid target-bound completion packet is available."}],"verified":[]}
