{"blockers":[],"context_refs":[],"contract_version":"handoff-packet/v1","current_state":"TODO","decisions":[],"estimated_token_count":720,"generated_at":"2026-07-15T06:32:58Z","intent_index_ref":null,"next_safe_action":{"command":"pcl context pack --task T-0066 --include-code-context --json","text":"Review fresh target-bound context before continuing implementation."},"omitted_sections":["evidence_bodies","full_transcript"],"packet_id":"hp-sha256:80463189a33bcaa99156271d65e755dec11c376853c95f459df06cecdbdf5fb1","producer":{"name":"project-loop-harness","version":"0.5.0"},"restart_context":{"acceptance_ref":null,"acceptance_status":"intent_only","changed_paths":[],"documentation_candidates":[],"evidence_resolution_commands":[],"target_intent":"0181として、外部利用者を待たず2つの所有repo・10ケースでclaim-bound Trace resumeを実測し、broken binding safe-stop・trust境界・size比を評価する","target_review_command":"pcl task read T-0066 --json","verification_commands":[]},"risks":[],"size_bytes":1648,"summary":"Task T-0066 (0181として、外部利用者を待たず2つの所有repo・10ケースでclaim-bound Trace resumeを実測し、broken binding safe-stop・trust境界・size比を評価する) is todo; no valid target-bound completion packet was found.","target":{"id":"T-0066","repository_revision":"e40168577a63514fb39170c343b91e9e68bd31d0","type":"task","work_brief_ref":null},"token_estimator":"charclass/v1","unverified":[{"reason":"Resume does not promote state or Evidence summaries into verified facts.","text":"No valid target-bound completion packet is available."}],"verified":[]}
