{"blockers":[],"context_refs":[{"freshness":"current","kind":"intent-index/v0","ref":"evidence:E-0427","sha256":"sha256:025d38318bc43fe6cadae8abd513190920c8a59dbc13702446ef83141d002343"},{"freshness":"current","kind":"master-trace/v0","ref":"evidence:E-0423","sha256":"sha256:a4af8f360aaf55273eafcbf62db414b2d8469e36e9ffce2e74cbab96e4cfd384"}],"contract_version":"handoff-packet/v1","current_state":"TODO","decisions":[],"estimated_token_count":1242,"generated_at":"2026-07-15T07:16:32Z","intent_index_ref":"evidence:E-0427","next_safe_action":{"command":"pcl context pack --task T-0090 --include-code-context --json","text":"Review fresh target-bound context before continuing implementation."},"omitted_sections":["evidence_bodies","full_transcript"],"packet_id":"hp-sha256:622b7b52a184e1d049e9940ddc075ccbf27d0e3fd057ea1589decffd11739dc6","producer":{"name":"project-loop-harness","version":"0.5.0"},"restart_context":{"acceptance_ref":null,"acceptance_status":"intent_only","changed_paths":[],"documentation_candidates":[],"evidence_resolution_commands":["pcl evidence show E-0423 --json","pcl evidence show E-0427 --json"],"target_intent":"TRE2-004 project-loop-harness valid resume","target_review_command":"pcl task read T-0090 --json","verification_commands":[]},"risks":["Task risk is low."],"size_bytes":2679,"summary":"Task T-0090 (TRE2-004 project-loop-harness valid resume) is todo; no valid target-bound completion packet was found.","target":{"id":"T-0090","repository_revision":"e40168577a63514fb39170c343b91e9e68bd31d0","type":"task","work_brief_ref":null},"token_estimator":"charclass/v1","trace_claim_ref_budget":{"included_bytes":742,"included_items":2,"max_bytes":4096,"max_items":8},"trace_claim_ref_omissions":[],"trace_claim_refs":[{"claim":"The consumer must keep claims unverified and must not treat this evaluation as publication authorization.","intent_index_ref":"evidence:E-0427","item_id":"I-001","kind":"constraint_hint","source_refs":[{"evidence_id":"E-0423","line_end":38,"line_start":36,"stored_path":".project-loop/evidence/adhoc-files/e-0423/01-v0.5.1-trace-source-02-a.md"}],"trust":"unverified"},{"claim":"Run the frozen repository A Trace contract test and report the bounded handoff conditions.","intent_index_ref":"evidence:E-0427","item_id":"I-002","kind":"next_action_hint","source_refs":[{"evidence_id":"E-0423","line_end":41,"line_start":39,"stored_path":".project-loop/evidence/adhoc-files/e-0423/01-v0.5.1-trace-source-02-a.md"}],"trust":"unverified"}],"unverified":[{"reason":"Resume does not promote state or Evidence summaries into verified facts.","text":"No valid target-bound completion packet is available."}],"verified":[]}
